row_number,question_text,correct_answer,knowledge_area,concept_id,concept_name,relevance,reasoning
145,"In Define Requirements Architecture (7.4), performing Functional Decomposition (a technique) helps t...",B,Requirements Analysis and Design Definition,,NO MAPPING,,
146,The purpose of Define Design Options (7.5) is to:...,B,Requirements Analysis and Design Definition,13ec23e5-e672-4221-b54c-ba535340bf75,Radd-Design-Options,1.0,Primary concept from CSV (score: 85%)
146,The purpose of Define Design Options (7.5) is to:...,B,Requirements Analysis and Design Definition,d07f796c-61ce-4b80-b72e-56e84e22f497,Purpose,0.7,Secondary concept from CSV tag 'purpose' (score: 100%)
147,A BA is exploring a design option that requires leveraging an existing technology platform but neces...,C,Requirements Analysis and Design Definition,e30066a5-30be-4349-a65c-9423b59a7059,Solution-Approach,1.0,Primary concept from CSV (score: 100%)
147,A BA is exploring a design option that requires leveraging an existing technology platform but neces...,C,Requirements Analysis and Design Definition,13ec23e5-e672-4221-b54c-ba535340bf75,Radd-Design-Options,0.7,Secondary concept from CSV tag 'design-options' (score: 85%)
148,Which activity within Define Design Options (7.5) involves assigning requirements to specific soluti...,C,Requirements Analysis and Design Definition,13ec23e5-e672-4221-b54c-ba535340bf75,Radd-Design-Options,0.7,Secondary concept from CSV tag 'design-options' (score: 85%)
149,"In assessing design options (7.5), the BA identifies an opportunity to consolidate several disparate...",C,Requirements Analysis and Design Definition,,NO MAPPING,,
150,The primary input used to ensure that design options address the full set of interdependencies and r...,A,Requirements Analysis and Design Definition,2ab6bea8-8d56-4c02-89d7-e6f27dce9f84,Inputs,0.7,Secondary concept from CSV tag 'inputs' (score: 100%)
151,The purpose of Analyze Potential Value and Recommend Solution (7.6) is to:...,B,Requirements Analysis and Design Definition,d07f796c-61ce-4b80-b72e-56e84e22f497,Purpose,0.7,Secondary concept from CSV tag 'purpose' (score: 100%)
152,"During the evaluation of design options (7.6), the BA analyzes the financial trade-offs. The BA calc...",D,Requirements Analysis and Design Definition,ae8cef51-f3d8-4718-b6eb-2f0f169660f8,Financial-Analysis,1.0,Primary concept from CSV (score: 100%)
153,A BA is comparing three design options. Option 1 offers high financial return but high technical ris...,B,Requirements Analysis and Design Definition,b9d11be4-2409-4486-b5cd-c4a4c03ed488,Risk-Tolerance,1.0,Primary concept from CSV (score: 100%)
153,A BA is comparing three design options. Option 1 offers high financial return but high technical ris...,B,Requirements Analysis and Design Definition,c996b989-53cc-447b-a114-39bc0597c1ac,Trade-Offs,0.7,Secondary concept from CSV tag 'trade-offs' (score: 100%)
154,Which element of Analyze Potential Value and Recommend Solution (7.6) requires the BA to consider al...,B,Requirements Analysis and Design Definition,,NO MAPPING,,
155,The final output of Analyze Potential Value and Recommend Solution (7.6) is the Solution Recommendat...,C,Requirements Analysis and Design Definition,c14940eb-89da-4b9d-a413-e0bd371d3182,Outputs,0.7,Secondary concept from CSV tag 'outputs' (score: 100%)
156,"If a proposed solution offers substantial benefits that are difficult to quantify (e.g., improved st...",B,Requirements Analysis and Design Definition,ee1434df-6985-4ff3-bbe8-c4642515dc4b,Intangible-Value,1.0,Primary concept from CSV (score: 100%)
157,The purpose of Measure Solution Performance (8.1) is to:...,B,Solution Evaluation,d07f796c-61ce-4b80-b72e-56e84e22f497,Purpose,0.7,Secondary concept from CSV tag 'purpose' (score: 100%)
158,A BA is attempting to measure the performance of a newly implemented training solution. The BA obser...,B,Solution Evaluation,,NO MAPPING,,
159,Which input is mandatory for the Measure Solution Performance task (8.1)?...,B,Solution Evaluation,2ab6bea8-8d56-4c02-89d7-e6f27dce9f84,Inputs,1.0,Primary concept from CSV (score: 100%)
160,A BA is defining performance measures (8.1.4.1) for a new customer service portal. Which measure ali...,C,Solution Evaluation,2c5fd8cb-5e25-42dc-af14-d5406e540ef9,Balanced-Scorecard,1.0,Primary concept from CSV (score: 100%)
161,The primary output of Measure Solution Performance (8.1) is:...,B,Solution Evaluation,c14940eb-89da-4b9d-a413-e0bd371d3182,Outputs,0.7,Secondary concept from CSV tag 'outputs' (score: 100%)
162,A BA seeks to validate performance measures (8.1.4.2) for a change that aims to improve regulatory c...,C,Solution Evaluation,fe376fe1-233d-434a-a999-e48df175333e,Regulator,1.0,Primary concept from CSV (score: 100%)
162,A BA seeks to validate performance measures (8.1.4.2) for a change that aims to improve regulatory c...,C,Solution Evaluation,03055617-3d86-4d9f-8671-794d03261bed,Stakeholders,0.7,Secondary concept from CSV tag 'stakeholders' (score: 100%)
163,The purpose of Analyze Performance Measures (8.2) is to:...,A,Solution Evaluation,d07f796c-61ce-4b80-b72e-56e84e22f497,Purpose,0.7,Secondary concept from CSV tag 'purpose' (score: 100%)
164,"A BA analyzes performance data and finds a significant, repeated drop in transaction speed every Mon...",D,Solution Evaluation,b91d7932-eeeb-444b-b8ba-23156931248a,Performance-Variances,1.0,Primary concept from CSV (score: 100%)
164,"A BA analyzes performance data and finds a significant, repeated drop in transaction speed every Mon...",D,Solution Evaluation,7b0be0f5-b326-4f84-aaf5-600649bcbb6a,Root-Cause-Analysis,0.7,Secondary concept from CSV tag 'root-cause-analysis' (score: 100%)
165,A core challenge in Analyze Performance Measures (8.2) is assessing solution performance versus desi...,C,Solution Evaluation,82496dea-3538-417d-96af-faec82400373,Value-Gap,1.0,Primary concept from CSV (score: 100%)
166,"Which input defines the expected returns and goals, providing the benchmark against which actual sol...",C,Solution Evaluation,d53964fa-d65a-4865-b70a-4d7a1a169735,Potential-Value,1.0,Primary concept from CSV (score: 100%)
166,"Which input defines the expected returns and goals, providing the benchmark against which actual sol...",C,Solution Evaluation,2ab6bea8-8d56-4c02-89d7-e6f27dce9f84,Inputs,0.7,Secondary concept from CSV tag 'inputs' (score: 100%)
167,The primary output of Analyze Performance Measures (8.2) is:...,C,Solution Evaluation,c14940eb-89da-4b9d-a413-e0bd371d3182,Outputs,0.7,Secondary concept from CSV tag 'outputs' (score: 100%)
168,The purpose of Assess Solution Limitations (8.3) is to:...,A,Solution Evaluation,d07f796c-61ce-4b80-b72e-56e84e22f497,Purpose,0.7,Secondary concept from CSV tag 'purpose' (score: 100%)
169,A BA determines that an implemented software module is repeatedly producing inaccurate outputs due t...,B,Solution Evaluation,e125b090-def4-4839-bf09-58a108e5828c,Investigate-Problems,1.0,Primary concept from CSV (score: 100%)
170,A BA uses Acceptance and Evaluation Criteria (a technique) during Assess Solution Limitations (8.3) ...,B,Solution Evaluation,,NO MAPPING,,
171,The primary output of Assess Solution Limitations (8.3) is:...,B,Solution Evaluation,c14940eb-89da-4b9d-a413-e0bd371d3182,Outputs,0.7,Secondary concept from CSV tag 'outputs' (score: 100%)
172,"When performing an Impact Assessment (8.3.4.3) on an internal solution problem, the BA must determin...",B,Solution Evaluation,d40d7e4c-a0f8-4d9f-b158-fa9f1d6465d8,Impact-Assessment,1.0,Primary concept from CSV (score: 100%)
173,The purpose of Assess Enterprise Limitations (8.4) is to:...,A,Solution Evaluation,d07f796c-61ce-4b80-b72e-56e84e22f497,Purpose,0.7,Secondary concept from CSV tag 'purpose' (score: 100%)
174,"A BA conducts an organizational assessment (8.4.4.1) and finds that end users view the new, efficien...",C,Solution Evaluation,5db05c67-eb95-4053-add5-dbc61d1e916a,Adoption,0.7,Secondary concept from CSV tag 'adoption' (score: 100%)
175,The BA performs an Operational Assessment (8.4.4.4) on the enterprise. Which item is typically inclu...,A,Solution Evaluation,0d8c037a-ac3a-4fd8-aec1-d133371e2531,Operational-Assessment,1.0,Primary concept from CSV (score: 100%)
176,Which technique is most effective for visualizing required organizational structural changes (report...,C,Solution Evaluation,,NO MAPPING,,
177,The core input required for Assess Enterprise Limitations (8.4) that provides context regarding the ...,B,Solution Evaluation,4f6bbd0d-d1ad-498f-837c-b9e0ec2f2535,Current-State,1.0,Primary concept from CSV (score: 100%)
177,The core input required for Assess Enterprise Limitations (8.4) that provides context regarding the ...,B,Solution Evaluation,2ab6bea8-8d56-4c02-89d7-e6f27dce9f84,Inputs,0.7,Secondary concept from CSV tag 'inputs' (score: 100%)
178,The purpose of Recommend Actions to Increase Solution Value (8.5) is to:...,A,Solution Evaluation,e4214fb0-68d6-445d-8f70-737ba76b0658,Radd-Value-Recommendation,1.0,Primary concept from CSV (score: 89%)
178,The purpose of Recommend Actions to Increase Solution Value (8.5) is to:...,A,Solution Evaluation,d07f796c-61ce-4b80-b72e-56e84e22f497,Purpose,0.7,Secondary concept from CSV tag 'purpose' (score: 100%)
179,"A BA determines that an underperforming solution, despite having high potential value, should be 'Re...",D,Solution Evaluation,c2f77be1-b397-4d30-a8a6-27e34379d359,Sunk-Cost,1.0,Primary concept from CSV (score: 100%)
180,A BA recommends 'Organizational Change' as the action to increase value (8.5). Which component might...,A,Solution Evaluation,e4214fb0-68d6-445d-8f70-737ba76b0658,Radd-Value-Recommendation,0.7,Secondary concept from CSV tag 'value-recommendation' (score: 89%)
181,Which technique is explicitly recommended for determining the impact of acting on any potential valu...,C,Solution Evaluation,e4214fb0-68d6-445d-8f70-737ba76b0658,Radd-Value-Recommendation,0.7,Secondary concept from CSV tag 'value-recommendation' (score: 89%)
182,The primary inputs for Recommend Actions to Increase Solution Value (8.5) are the:...,A,Solution Evaluation,2ab6bea8-8d56-4c02-89d7-e6f27dce9f84,Inputs,0.7,Secondary concept from CSV tag 'inputs' (score: 100%)
183,A project's success hinges on aligning all requirements with the core organizational strategy. This ...,C,Business Analysis Planning and Monitoring,742b36e7-e495-4db9-ae19-a9a84a495361,Strategy-Alignment,0.7,Secondary concept from CSV tag 'strategy-alignment' (score: 100%)
184,A Business Analyst frequently generates multiple innovative alternatives when faced with stakeholder...,C,Business Analysis Planning and Monitoring,0230d6cd-35bd-4b58-87a0-3ec1f78ec669,Creative-Thinking,1.0,Primary concept from CSV (score: 100%)
185,"During a conflict resolution meeting, the BA uses a whiteboard to draw a diagram showing how a propo...",B,Business Analysis Planning and Monitoring,c24f7ec7-0b8c-4548-9ad4-5443f3e66828,Visual-Thinking,0.7,Secondary concept from CSV tag 'visual-thinking' (score: 100%)
186,A key measure of effective 'Learning' for a Business Analyst is:...,B,Business Analysis Planning and Monitoring,c97a767d-0177-4b2c-ba11-27d1090a05fe,Learning,1.0,Primary concept from CSV (score: 100%)
187,A project team is suffering from 'analysis paralysis' due to constantly seeking more data before sel...,B,Business Analysis Planning and Monitoring,,NO MAPPING,,
188,"The BA receives continuous praise for completing tasks on time, ensuring deliverables meet expectati...",C,Business Analysis Planning and Monitoring,,NO MAPPING,,
189,"Which characteristic is described by the BA's ability to adjust their techniques, style, and method ...",C,Business Analysis Planning and Monitoring,,NO MAPPING,,
190,A BA discovers a conflict of interest involving the recommended vendor. The BA immediately discloses...,C,Business Analysis Planning and Monitoring,,NO MAPPING,,
191,A key measure of effective 'Organization and Time Management' is:...,C,Business Analysis Planning and Monitoring,,NO MAPPING,,
192,"In an organization utilizing a fixed, waterfall methodology, the BA is asked to quickly pivot to an ...",B,Business Analysis Planning and Monitoring,,NO MAPPING,,
193,A BA is reviewing the financial viability of a strategic initiative by comparing it against industry...,C,Business Analysis Planning and Monitoring,,NO MAPPING,,
194,"When a BA is working to improve an existing, complex proprietary solution, proficiency in which comp...",C,Business Analysis Planning and Monitoring,,NO MAPPING,,
195,"A BA quickly grasps the political landscape, reporting relationships, and informal lines of influenc...",B,Business Analysis Planning and Monitoring,,NO MAPPING,,
196,The definition of 'Business Acumen' emphasizes the ability to:...,A,Business Analysis Planning and Monitoring,,NO MAPPING,,
197,A BA is facilitating a workshop with globally distributed team members. To minimize ambiguity due to...,B,Business Analysis Planning and Monitoring,,NO MAPPING,,
198,"During an intense interview, the interviewee's verbal response is positive, but their body language ...",A,Business Analysis Planning and Monitoring,,NO MAPPING,,
199,"A BA's presentation style emphasizes clear structure, logical sequencing of ideas, and visual aids a...",B,Business Analysis Planning and Monitoring,,NO MAPPING,,
200,A BA mediates a difficult negotiation between the budget owner and the solution team regarding scope...,C,Business Analysis Planning and Monitoring,,NO MAPPING,,
201,"When performing the 'Teaching' underlying competency, the BA must select the most appropriate teachi...",B,Business Analysis Planning and Monitoring,,NO MAPPING,,
202,A BA is asked to use a Requirements Management Tool (a Tools and Technology competency) for a high-r...,B,Business Analysis Planning and Monitoring,2a01a58f-8629-4f83-a4c6-29d85e8abb57,Requirements-Management-Tool,0.7,Secondary concept from CSV tag 'requirements-management-tool' (score: 100%)
203,A BA is working on a high-velocity agile project focused on internal process improvement. The questi...,C,Agile Perspective,d70cd8cf-ea49-4813-85ba-e623e753d3ab,Strategy-Analysis,0.7,Secondary concept from CSV tag 'strategy-analysis' (score: 100%)
204,"In an agile environment, detailed analysis work is typically deferred until the last responsible mom...",B,Agile Perspective,,NO MAPPING,,
205,"In the Agile Perspective, validation of the evolving solution with stakeholders occurs frequently, o...",B,Agile Perspective,4a5baa17-58bd-445f-ae56-1ca57a29b4e7,Validation,0.7,Secondary concept from CSV tag 'validation' (score: 100%)
206,Which agile technique uses fictional characters to help the team understand the needs held by a grou...,C,Agile Perspective,d629c0fa-9f03-438a-9666-3eb0aae0771a,Personas,1.0,Primary concept from CSV (score: 100%)
207,A BA on an agile team prioritizes a high-level list of features using the MoSCoW technique. Which fa...,B,Agile Perspective,68614fc7-6d19-40f4-b3dc-906d9f88b3a7,Moscow,1.0,Primary concept from CSV (score: 100%)
208,The primary focus of a Business Intelligence (BI) initiative is the transformation of data into:...,C,Business Intelligence Perspective,,NO MAPPING,,
209,A BI business analyst is defining requirements for a new dashboard intended to predict customer chur...,C,Business Intelligence Perspective,,NO MAPPING,,
210,"In the BI Perspective, the BA often needs to ensure information is consistently defined and used acr...",A,Business Intelligence Perspective,51586eea-6280-4ba3-8325-1accdf5d50ef,Data-Dictionary,0.7,Secondary concept from CSV tag 'data-dictionary' (score: 100%)
211,A demand-driven approach in Business Intelligence assumes which starting point for solution developm...,C,Business Intelligence Perspective,29d4a2bb-7a00-4cc3-9da8-42099ff42d6e,Demand-Driven,1.0,Primary concept from CSV (score: 100%)
212,A BI BA is tasked with defining Transformation Rules (8.5). What is the primary purpose of these rul...,A,Business Intelligence Perspective,06ba0e30-7e41-4c59-8b3c-72eff637d887,Transformation-Rules,1.0,Primary concept from CSV (score: 100%)
213,"In the Business Architecture (BA-Arch) Perspective, the principle of 'Separation of Concerns' implie...",D,Business Architecture Perspective,a97c6207-605a-4d21-a94b-d530fb629754,Separation-Of-Concerns,1.0,Primary concept from CSV (score: 100%)
213,"In the Business Architecture (BA-Arch) Perspective, the principle of 'Separation of Concerns' implie...",D,Business Architecture Perspective,d9d4e847-f610-40dc-ba93-d73575e9eda8,Ba-Arch,0.7,Secondary concept from CSV tag 'ba-arch' (score: 100%)
214,A Business Architect is developing a Capability Map (a technique). The purpose of this map is to:...,B,Business Architecture Perspective,d9d4e847-f610-40dc-ba93-d73575e9eda8,Ba-Arch,0.7,Secondary concept from CSV tag 'ba-arch' (score: 100%)
215,A key value delivered by Business Architecture models (blueprints) is:...,B,Business Architecture Perspective,d9d4e847-f610-40dc-ba93-d73575e9eda8,Ba-Arch,1.0,Primary concept from CSV (score: 100%)
215,A key value delivered by Business Architecture models (blueprints) is:...,B,Business Architecture Perspective,68e8c669-87f1-49e5-93fd-7e9dae9332ea,Alignment,0.7,Secondary concept from CSV tag 'alignment' (score: 100%)
216,"When performing Strategy Analysis (6.1/6.2) in a BA-Arch context, the focus of analyzing the current...",B,Business Architecture Perspective,d9d4e847-f610-40dc-ba93-d73575e9eda8,Ba-Arch,1.0,Primary concept from CSV (score: 100%)
216,"When performing Strategy Analysis (6.1/6.2) in a BA-Arch context, the focus of analyzing the current...",B,Business Architecture Perspective,c7735d7a-f87b-4751-8b2a-bf0d344b3f96,Enterprise-Scope,0.7,Secondary concept from CSV tag 'enterprise-scope' (score: 100%)
217,"The Business Architect, working in the Requirements Analysis and Design Definition KA, synthesizes k...",B,Business Architecture Perspective,d9d4e847-f610-40dc-ba93-d73575e9eda8,Ba-Arch,1.0,Primary concept from CSV (score: 100%)
217,"The Business Architect, working in the Requirements Analysis and Design Definition KA, synthesizes k...",B,Business Architecture Perspective,e3034848-5f4f-4dcc-b88f-6fe27abd7d92,Strategic-Alignment,0.7,Secondary concept from CSV tag 'strategic-alignment' (score: 100%)
218,The primary focus of Business Process Management (BPM) initiatives is:...,A,Business Process Management Perspective,d07f796c-61ce-4b80-b72e-56e84e22f497,Purpose,0.7,Secondary concept from CSV tag 'purpose' (score: 100%)
219,A BA leading a BPM initiative uses the execution and monitoring phase of the BPM life cycle. What un...,A,Business Process Management Perspective,,NO MAPPING,,
220,Which stakeholder is considered the key decision maker and holds responsibility/authority for approv...,C,Business Process Management Perspective,19286b1e-52cf-4dec-94c0-84fb6426dd44,Process-Owner,1.0,Primary concept from CSV (score: 100%)
220,Which stakeholder is considered the key decision maker and holds responsibility/authority for approv...,C,Business Process Management Perspective,03055617-3d86-4d9f-8671-794d03261bed,Stakeholders,0.7,Secondary concept from CSV tag 'stakeholders' (score: 100%)
221,A BA conducting process analysis uses Value Stream Mapping (VSM). This technique is primarily used t...,B,Business Process Management Perspective,,NO MAPPING,,
222,A BA identifies a set of business rules that dictate customer eligibility for a discount. These rule...,B,Business Process Management Perspective,d72df9e5-d72f-4ddd-8d31-a70e4e3a8081,Business-Rules,1.0,Primary concept from CSV (score: 100%)
222,A BA identifies a set of business rules that dictate customer eligibility for a discount. These rule...,B,Business Process Management Perspective,a0b8f375-992c-4a12-85b1-ae11f8424a62,Decision-Modelling,0.7,Secondary concept from CSV tag 'decision-modelling' (score: 100%)
223,The BA must establish explicit agreement on the minimal set of conditions a new solution must meet t...,B,Requirements Analysis and Design Definition,,NO MAPPING,,
224,A BA is drafting Acceptance Criteria for a user story (7.1). The criteria must be expressed in a tes...,B,Requirements Analysis and Design Definition,9a5ea0ed-5c6d-4295-9982-e312a77d8fc6,Atomic,0.7,Secondary concept from CSV tag 'atomic' (score: 100%)
225,The primary advantage of using the Acceptance and Evaluation Criteria technique is:...,B,Requirements Analysis and Design Definition,,NO MAPPING,,
226,A BA uses a Balance Scorecard (a technique) during Define Future State (6.2). The primary benefit of...,C,Strategy Analysis,2c5fd8cb-5e25-42dc-af14-d5406e540ef9,Balanced-Scorecard,1.0,Primary concept from CSV (score: 100%)
226,A BA uses a Balance Scorecard (a technique) during Define Future State (6.2). The primary benefit of...,C,Strategy Analysis,d07f796c-61ce-4b80-b72e-56e84e22f497,Purpose,0.7,Secondary concept from CSV tag 'purpose' (score: 100%)
227,"When performing Backlog Management (a technique), items near the top of the backlog typically requir...",A,Requirements Life Cycle Management,,NO MAPPING,,
228,"A growing backlog over several iterations, despite steady team velocity, is an indicator that requir...",A,Requirements Life Cycle Management,d3af9ebb-998b-487a-9935-652e52418bb5,Metrics,0.7,Secondary concept from CSV tag 'metrics' (score: 100%)
229,The primary input used to justify the pursuit of a new initiative based on predicted benefits versus...,B,Strategy Analysis,4a4c721d-50dd-4e30-8641-2902757d5f66,Business-Case,1.0,Primary concept from CSV (score: 100%)
229,The primary input used to justify the pursuit of a new initiative based on predicted benefits versus...,B,Strategy Analysis,ff29e3df-1067-4d65-9cc7-f0360a5e66f7,Justification,0.7,Secondary concept from CSV tag 'justification' (score: 100%)
230,"When structuring a Business Case (a technique), the 'Desired Outcomes' element should primarily focu...",B,Strategy Analysis,4a4c721d-50dd-4e30-8641-2902757d5f66,Business-Case,1.0,Primary concept from CSV (score: 100%)
230,"When structuring a Business Case (a technique), the 'Desired Outcomes' element should primarily focu...",B,Strategy Analysis,d35e0f95-0b45-455a-8526-752442999135,Desired-Outcomes,0.7,Secondary concept from CSV tag 'desired-outcomes' (score: 100%)
231,A BA utilizes Interviews (a technique) to gather information from a stakeholder. To maximize the cla...,C,Elicitation and Collaboration,e49285a4-b6df-497c-a59d-a1d804675e3a,Interviews,1.0,Primary concept from CSV (score: 100%)
232,A BA is documenting a stakeholder’s needs for a new regulatory system. The stakeholder is highly tec...,C,Elicitation and Collaboration,e49285a4-b6df-497c-a59d-a1d804675e3a,Interviews,1.0,Primary concept from CSV (score: 100%)
232,A BA is documenting a stakeholder’s needs for a new regulatory system. The stakeholder is highly tec...,C,Elicitation and Collaboration,a410d588-9674-49c9-93f5-c91372ce34fa,Closed-Questions,0.7,Secondary concept from CSV tag 'closed-questions' (score: 100%)
233,A Business Analyst uses Prototyping (a technique) specifically in the exploratory or 'throw-away' mo...,B,Requirements Analysis and Design Definition,f14d66c2-f452-4bca-9f26-05d7045e7847,Prototyping,1.0,Primary concept from CSV (score: 100%)
233,A Business Analyst uses Prototyping (a technique) specifically in the exploratory or 'throw-away' mo...,B,Requirements Analysis and Design Definition,633dff15-fa60-4228-aecd-e2b8386bed30,Throw-Away,0.7,Secondary concept from CSV tag 'throw-away' (score: 100%)
234,"During a Workshop (a technique), the facilitator must establish ground rules at the beginning. Which...",D,Elicitation and Collaboration,a7d0c4a2-2ee7-42fc-9460-fb67b0a14d1c,Workshops,1.0,Primary concept from CSV (score: 100%)
235,The primary deliverable produced during a Workshop (a technique) is expected to be:...,D,Elicitation and Collaboration,a7d0c4a2-2ee7-42fc-9460-fb67b0a14d1c,Workshops,1.0,Primary concept from CSV (score: 100%)
235,The primary deliverable produced during a Workshop (a technique) is expected to be:...,D,Elicitation and Collaboration,c14940eb-89da-4b9d-a413-e0bd371d3182,Outputs,0.7,Secondary concept from CSV tag 'outputs' (score: 100%)
236,A Business Analyst initiates the Plan Stakeholder Engagement task (3.2). The initial list of stakeho...,C,Business Analysis Planning and Monitoring,fee42d0d-4f45-424c-acee-15bd802d532f,Stakeholder-Analysis,1.0,Primary concept from CSV (score: 100%)
236,A Business Analyst initiates the Plan Stakeholder Engagement task (3.2). The initial list of stakeho...,C,Business Analysis Planning and Monitoring,4571a29e-6be8-47d1-9714-05288a6da466,Engagement-Planning,0.7,Secondary concept from CSV tag 'engagement-planning' (score: 100%)
237,"In using the SWOT Analysis technique, a BA identifies that 'Competitor A launched a superior, cheape...",D,Strategy Analysis,e2490004-e566-4a5d-a3c9-34a66d3e28d3,Swot-Analysis,1.0,Primary concept from CSV (score: 100%)
