question_text,option_a,option_b,option_c,option_d,correct_answer,explanation,ka,difficulty_label,difficulty_b,discrimination,guess_rate,slip_rate,primary_concept,secondary_concepts,babok_reference,perspectives,competencies
"A new initiative requires integrating two legacy systems. You anticipate significant stakeholder resistance due to past failures. In planning the BA approach (3.1), what is your primary concern?",Defining detailed use cases upfront to mitigate risk.,Securing formal sign-off for all documentation.,Tailoring the engagement model to address low trust and high influence stakeholders.,Selecting COTS software to accelerate delivery.,C,The planning approach (3.1) must align with the stakeholder context (inputs from 3.2). Anticipating resistance requires adjusting the engagement strategy to build trust and manage influential resistance.,Business Analysis Planning and Monitoring,Medium,0.35,1.4,0.2,0.05,stakeholder-engagement,adaptability,3.1.4.5,it,behavioral;
"The regulatory environment surrounding your project is highly complex and volatile. As you begin to Plan Business Analysis Approach (3.1), what methodology characteristic should you prioritize?",A predictive approach requiring full formal documentation of requirements.,An adaptive approach allowing continuous revision and risk mitigation.,A hybrid approach balancing high-level scope and low-level detail.,An iterative approach focused only on technology solutions.,B,High environmental uncertainty (context) favors an Adaptive approach which focuses on rapid delivery in short iterations and accepts a higher degree of uncertainty regarding solution delivery.,Business Analysis Planning and Monitoring,Hard,2.1,1.85,0.15,0.12,ba-approach,predictive-adaptive,3.1.4.1,,analytical;
A business analyst is defining the structure for their forthcoming requirement package. What should guide the level of formality and detail of this package?,Organizational standards and the complexity of the change.,The preference of the Project Manager.,The availability of specialized modeling tools.,The number of domain subject matter experts involved.,A,"The level of formality for deliverables is determined by organizational methodologies, required compliance, complexity, and risk.",Business Analysis Planning and Monitoring,Medium,-0.42,1.15,0.25,0.04,deliverables,formality,3.1.4.2,,analytical;
The purpose of the Plan Business Analysis Approach task (3.1) is best described as:,"Defining the timing, sequence, and deliverables of BA work to coordinate efforts.",Identifying all relevant stakeholders and their communication needs.,Establishing the mechanism for making decisions about requirements and designs.,Determining the business need and assessing potential risks.,A,The purpose of Plan Business Analysis Approach is to define an appropriate method to conduct business analysis activities.,Business Analysis Planning and Monitoring,Easy,-1.85,0.9,0.25,0.02,ba-approach,timing,3.1.1,,analytical;
Which element of the Plan Business Analysis Approach task involves selecting whether requirements will be defined before implementation begins or iteratively throughout delivery?,Planning Approach.,Business Analysis Activities.,Timing of Business Analysis Work.,Formality and Level of Detail.,A,The Planning Approach element involves assessing predictive versus adaptive approaches to determine how requirements are defined.,Business Analysis Planning and Monitoring,Easy,-2.4,0.85,0.25,0.01,planning-approach,predictive-adaptive,3.1.4.1,agile,analytical;
The primary output of the Plan Business Analysis Approach task (3.1) is the:,Business Analysis Approach.,Stakeholder Engagement Approach.,Governance Approach.,Business Analysis Performance Assessment.,A,"The output of Plan Business Analysis Approach is the Business Analysis Approach, identifying activities and timing.",Business Analysis Planning and Monitoring,Easy,-1.25,0.95,0.25,0.03,ba-approach,outputs,3.1.8,,analytical;
"While defining the BA Approach, the business analyst uses Expert Judgment (a guideline/tool) to determine the best approach. Which source typically contributes to Expert Judgment?",Organizational Centres of Excellence.,Prior experiences of the business analyst and stakeholders.,Consultants or industry groups.,All of the above.,D,"Expert Judgment draws from internal centers of excellence, consultants, associations, and prior experience.",Business Analysis Planning and Monitoring,Easy,-1.6,0.75,0.25,0.02,expert-judgment,tools-and-techniques,3.1.5,,business-knowledge;
A Business Analyst determined that a project's high complexity and the organization’s low tolerance for uncertainty necessitate a predictive approach. Which factor most influenced this decision?,Stakeholder attitude regarding collaboration.,The high risk associated with an incorrect implementation.,The availability of tools and technology.,The ability to reuse historical requirements.,B,Predictive approaches focus on minimizing upfront uncertainty and are preferred when the risk of an incorrect implementation is unacceptably high.,Business Analysis Planning and Monitoring,Medium,0.68,1.35,0.22,0.06,predictive-approach,risk-management,3.1.4.1,,analytical;
"A large, multi-year program requires the Business Analyst to define how all subsequent planning will be conducted. To align the BA approach (3.1) with the overall goals of the change, the most critical external input is the:",Needs (problem or opportunity).,Business Analysis Performance Assessment.,Business Policies.,Methodologies and Frameworks.,A,The business analysis approach is fundamentally shaped by the problem or opportunity (Needs) faced by the organization.,Business Analysis Planning and Monitoring,Medium,0.22,1.25,0.25,0.05,needs,ba-approach,3.1.3,,analytical;
The Project Manager reviews the proposed Business Analysis Approach (3.1). Why is their review critical?,To approve the BA budget and schedule.,To ensure the approach aligns with the overall project schedule and timelines.,To validate the technical feasibility of the proposed solutions.,To define the level of formality for documentation.,B,The Project Manager ensures the BA approach is realistic for the overall schedule and compatible with other project activities.,Business Analysis Planning and Monitoring,Medium,-0.15,1.1,0.25,0.05,stakeholders,alignment,3.1.7,,interaction;
"You are initiating a high-profile, cross-functional initiative impacting five departments, three of which have vocal, dissenting managers. In the Plan Stakeholder Engagement task (3.2), what activity is most vital to managing potential conflict?",Conducting a formal workshop to define the business objectives.,"Performing an in-depth Stakeholder Analysis to identify their roles, attitudes, and influence.",Defining the Stakeholder Communication Plan to minimize direct interaction.,Presenting the completed Governance Approach for immediate approval.,B,Performing a detailed Stakeholder Analysis to understand attitudes and influence is vital for defining effective collaboration strategies.,Business Analysis Planning and Monitoring,Medium,0.55,1.55,0.2,0.07,stakeholder-analysis,conflict-resolution,3.2.4.1,,interaction;
"During the execution of a change, a key stakeholder's attitude shifts from positive to highly negative due to perceived budget constraints. What is the immediate responsibility of the Business Analyst in managing this engagement (4.5)?",Update the Business Analysis Approach to reflect increased formality.,Develop risk plans and strategies tailored to mitigate the stakeholder’s negative attitude.,Remove the stakeholder from the communication plan to avoid further disruption.,Escalate the issue directly to the sponsor for resolution.,B,"If a key stakeholder views a change negatively, the BA must develop risk plans and strategies to address the attitude through collaboration.",Business Analysis Planning and Monitoring,Hard,2.85,2.4,0.12,0.15,stakeholder-engagement,behavioral-characteristics,4.5.4.2,,behavioral;
The primary input used to perform a comprehensive Stakeholder Analysis during the Plan Stakeholder Engagement task (3.2) is/are the:,Needs and the Business Analysis Approach.,Current State Description and Change Strategy.,Business Analysis Performance Assessment.,Governance Approach.,A,"The Needs help identify affected parts of the enterprise, and the Business Analysis Approach ensures consistency in planning.",Business Analysis Planning and Monitoring,Medium,0,1.2,0.25,0.05,stakeholder-analysis,inputs,3.2.3,,analytical;
"Which technique is explicitly recommended for detailing the relationships between stakeholders and the solution, aiding the Plan Stakeholder Engagement task (3.2)?","Stakeholder List, Map, or Personas.",Business Rules Analysis.,Root Cause Analysis.,Functional Decomposition.,A,"Stakeholder List, Map, or Personas is used to depict the relationship of stakeholders to the solution and to one another.",Business Analysis Planning and Monitoring,Easy,-2.1,0.85,0.25,0.01,stakeholder-map,stakeholder-analysis,3.2.6,,analytical;
A BA is drafting a stakeholder communication plan. Which factor determines the appropriate level of detail and formality for communication to a specific stakeholder group?,Their proximity to the development team.,The level of interest and influence they possess.,The complexity of the solution components.,The frequency of scheduled project meetings.,B,"Understanding the stakeholder’s characteristics, particularly attitudes and influence, dictates the communication approach.",Business Analysis Planning and Monitoring,Medium,0.45,1.3,0.22,0.06,communication-needs,formality,3.2.4.3,,communication;
The task Plan Stakeholder Engagement (3.2) directly supports the realization of which core concept by ensuring that all relevant viewpoints are considered in the initiative?,Context.,Value.,Stakeholder.,Change.,C,Business analysts perform a stakeholder analysis during BAPM to ensure planning reflects stakeholder needs and characteristics.,Business Analysis Planning and Monitoring,Easy,-2.5,0.8,0.25,0.01,core-concepts,stakeholders,2.1,,"analytical,interaction;"
A crucial step in defining stakeholder collaboration involves planning different engagement approaches for internal and external groups. Why might external stakeholders require a more deliberate and formal collaboration approach?,External stakeholders inherently possess higher power.,External parties often operate under contractual agreements necessitating formality.,External stakeholders are typically geographically dispersed.,External parties contribute less value to the overall initiative.,B,Contracts or agreements often necessitate high formality in engagement and deliverables with external suppliers or regulators.,Business Analysis Planning and Monitoring,Medium,0.3,1.25,0.25,0.05,collaboration,formality,3.2.4.2,,interaction;
"In an organization utilizing a complex, predictive methodology, the BA is defining the governance approach (3.3). What is the primary purpose of this task (3.3)?",To ensure that requirements are specified in enough detail for implementation.,"To define how decisions are made about requirements and designs, including change control and approvals.",To establish the method for storing and accessing business analysis information.,To identify and allocate resources to monitor solution performance.,B,The purpose of Plan Business Analysis Governance is to define how decisions are made about requirements and designs.,Business Analysis Planning and Monitoring,Easy,-1.9,0.85,0.25,0.02,ba-governance,purpose,3.3.1,,analytical;
The Business Analyst must establish who has the authority to approve changes to baselined requirements in a highly regulated industry. This activity is a key element of which task?,Plan Business Analysis Governance (3.3).,Assess Requirements Changes (5.4).,Approve Requirements (5.5).,Plan Business Analysis Information Management (3.4).,A,Defining who will authorize changes is an element of establishing the Change Control Process within the Plan Business Analysis Governance task.,Business Analysis Planning and Monitoring,Medium,0.12,1.3,0.25,0.05,change-control,approvals,3.3.4.2,,analytical;
"A project is starting with high uncertainty regarding technical feasibility. When planning the prioritization approach (3.3), which factor related to complexity and risk should the BA consider applying during prioritization?",Prioritizing requirements based solely on the highest perceived business benefit.,Prioritizing the most technically difficult requirements first to resolve high risks early.,Implementing a MoSCoW approach governed by the Sponsor.,Deferring all prioritization until the design options are fully assessed.,B,"If there is a high risk of non-feasibility, the most difficult requirement may be prioritized first to minimize wasted resources.",Business Analysis Planning and Monitoring,Hard,2.25,1.9,0.18,0.1,prioritization,risk,3.3.4.3,,analytical;
Which input is necessary for the Plan Business Analysis Governance task (3.3) to ensure that decision-making bodies reflect stakeholder needs?,Stakeholder Engagement Approach.,Business Analysis Approach.,Business Policies.,Current State Description.,A,The Stakeholder Engagement Approach provides information regarding which stakeholders exist and their collaboration needs for the governance approach.,Business Analysis Planning and Monitoring,Medium,-0.28,1.15,0.25,0.04,ba-governance,inputs,3.3.3,,analytical;
A BA is developing the change control process within Plan Business Analysis Governance (3.3). Which item is NOT typically determined within this element?,How changes will be documented (configuration management standards).,Who will perform the impact analysis on a proposed change.,How often the solution performance will be measured.,Who will authorize proposed changes.,C,"How often performance is measured is defined in Solution Evaluation (8.1) or Information Management (3.4), not the change control process.",Business Analysis Planning and Monitoring,Medium,0.4,1.4,0.2,0.05,change-control,ba-governance,3.3.4.2,,analytical;
The primary output of Plan Business Analysis Governance (3.3) is the Governance Approach. What does this output define?,The metrics used for measuring the performance of business analysis work.,The process for defining the future state and gap analysis.,The stakeholders responsible for setting priorities and approving changes.,The location and format for storing all requirements artifacts.,C,The Governance Approach identifies the stakeholders with authority for decisions and defines the change management process.,Business Analysis Planning and Monitoring,Easy,-1.75,0.9,0.25,0.02,governance-approach,outputs,3.3.8,,analytical;
"When planning for approvals (3.3.4.4), the BA must determine the timing and frequency. This consideration is most dependent upon which factors?",The organizational culture and the type of information being approved.,The availability of the implementation subject matter experts.,The estimated cost of the overall project.,The number of outstanding defects in the legacy system.,A,The timing and frequency of approvals are dependent on organizational culture and the type of information being approved.,Business Analysis Planning and Monitoring,Medium,0.33,1.2,0.25,0.05,approvals,culture,3.3.4.4,,interaction;
"During the Plan Business Analysis Information Management task (3.4), a BA must define how requirements will be structured and stored for future use. Which element specifically addresses maximizing the long-term utility of requirements across the enterprise?",Plan Traceability Approach.,Level of Abstraction.,Plan for Requirements Reuse.,Requirements Attributes.,C,"Planning for Requirements Reuse determines how to structure, store, and access requirements to be usable for future BA efforts.",Business Analysis Planning and Monitoring,Medium,0.52,1.45,0.2,0.06,requirements-reuse,information-management,3.4.4.4,,analytical;
A BA is planning the information management approach (3.4). The organization has chosen a requirements management tool. The tool's capabilities heavily influence the selection of techniques and notations used on the initiative. Which tool capability would be most relevant to minimizing manual effort in maintaining requirements relationships?,Generating customizable reports and dashboards.,Supporting the definition and storage of requirements attributes.,Automating requirements traceability and versioning.,Facilitating collaboration through discussion forums.,C,"Requirements management tools provide support for requirements traceability, allowing the automatic maintenance of relationships.",Business Analysis Planning and Monitoring,Medium,-0.05,1.25,0.25,0.05,information-management,tools-and-technology,3.4.4.5,it,tools-technology;
"Which requirement attribute helps distinguish between relative value and implementation urgency, enabling effective sequencing?",Priority and Risks.,Author and Ownership.,Stability and Source.,Priority and Urgency.,D,"Priority indicates relative importance, while Urgency indicates how soon the requirement is needed.",Business Analysis Planning and Monitoring,Easy,-2.2,0.85,0.25,0.01,requirements-attributes,priority,3.4.4.6,,analytical;
"A BA is defining the information management approach (3.4) for a new, highly complex solution. The key stakeholders are geographically dispersed and require rapid access to evolving models. Which consideration should drive the choice of storage location?",The level of abstraction required for the requirements.,"The need to support concurrent, multi-user access and real-time collaboration.",Organizational policies mandating PDF documentation only.,The projected retirement date of the solution.,B,"Storage decisions depend on who must access the information; for dispersed stakeholders, concurrent multi-user access tools are crucial.",Business Analysis Planning and Monitoring,Hard,2.48,2.15,0.15,0.15,storage-access,collaboration,3.4.4.5,,tools-technology;
"When structuring business analysis information for the Plan Business Analysis Information Management task (3.4), defining relationships among information types is essential for:",Determining the final level of detail for all requirements.,Minimizing stakeholder communication needs.,Managing the effect of new or changed information in the future.,Ensuring compliance with legal/regulatory information.,C,"Relationships must be defined to assist in managing the effect of new or changed information in the future, supporting traceability.",Business Analysis Planning and Monitoring,Medium,0.6,1.5,0.2,0.07,information-management,relationships,3.4.4.1,,analytical;
The primary output of the Plan Business Analysis Information Management task (3.4) is the:,Information Management Approach.,Requirements Architecture.,Governance Approach.,Requirements (maintained).,A,"The output is the Information Management Approach, defining how information is stored and accessed.",Business Analysis Planning and Monitoring,Easy,-2.65,0.8,0.25,0.01,information-management,outputs,3.4.8,,analytical;
The primary purpose of Identify Business Analysis Performance Improvements (3.5) is to:,Define how requirements will be stored and reused.,Assess business analysis work and plan to improve processes where required.,Obtain formal approval on the business requirements.,Determine how decisions about changes will be managed.,B,The purpose is to assess BA work performance and plan process improvements.,Business Analysis Planning and Monitoring,Easy,-1.4,0.9,0.25,0.03,ba-performance,purpose,3.5.1,,behavioral;
A BA conducts a performance analysis (3.5.4.1) based on metrics collected during the previous project phase. The analysis reveals that the rate of requirement defects detected late in the life cycle (post-development) significantly exceeded the organizational benchmark. This finding should immediately lead to a recommendation for which type of action?,"Preventive action, focusing on improving verification processes earlier in the lifecycle.","Corrective action, focusing on retraining the development team.","Improvement action, focusing on increasing technical resource allocation.","Acceptance action, noting the deviation as a one-time anomaly.",A,"A Preventive action aims to reduce the probability of a negative impact, such as improving verification early on.",Business Analysis Planning and Monitoring,Hard,2.15,2.1,0.15,0.12,ba-performance,preventive-action,3.5.4.4,,behavioral;
Which element of the Identify Business Analysis Performance Improvements task compares the performance of the BA process and deliverables against defined targets?,Performance Analysis.,Assessment Measures.,Analyze Results.,Recommend Actions for Improvement.,C,The Analyze Results element compares the BA process and deliverables against the set of defined measures.,Business Analysis Planning and Monitoring,Medium,-0.1,1.2,0.25,0.05,ba-performance,analyze-results,3.5.4.3,,behavioral;
The BA collected qualitative feedback from stakeholders indicating that the models produced were difficult to use and required extensive verbal explanation. Which assessment measure characteristic does this feedback relate to?,Accuracy and Completeness.,Effectiveness.,Timeliness.,Significance.,B,Effectiveness assesses whether BA work products were easy to use or required extensive explanation to be understood.,Business Analysis Planning and Monitoring,Medium,0.25,1.35,0.22,0.05,assessment-measures,effectiveness,3.5.4.2,,behavioral;
"The key input that defines the desired outcomes that an enterprise is hoping to achieve, against which BA work performance is measured, is the:",Business Analysis Approach.,Performance Objectives (external).,Organizational Performance Standards.,Business Analysis Performance Assessment.,B,Performance Objectives (external) describe the desired performance outcomes that an enterprise is hoping to achieve.,Business Analysis Planning and Monitoring,Easy,-1.95,0.85,0.25,0.02,ba-performance,inputs,3.5.3,,analytical;
A Business Analyst uses Root Cause Analysis (a technique) during Identify Business Analysis Performance Improvements (3.5). What is the primary focus of applying this technique in this context?,To track all open issues and defects found during the BA effort.,To generate ideas for future improvement opportunities.,To identify the underlying cause of failures or difficulties in accomplishing BA work.,To determine whether the BA approach aligned with organizational standards.,C,Root Cause Analysis helps identify the underlying cause of failures or difficulties in accomplishing business analysis work.,Business Analysis Planning and Monitoring,Medium,0.48,1.45,0.2,0.06,root-cause-analysis,ba-performance,10.40.1,,analytical;
The task Prepare for Elicitation (4.1) primarily involves:,Conducting the main elicitation activities and capturing outcomes.,Securing stakeholder commitment to implement the solution.,"Understanding the scope, selecting techniques, and planning logistics.",Confirming elicitation results against source documents.,C,"The purpose is to understand the scope of the activity, select techniques, and plan logistics and materials.",Elicitation and Collaboration,Easy,-1.15,0.95,0.25,0.03,elicitation-preparation,purpose,4.1.1,,communication;
A Business Analyst needs to elicit requirements for a major system overhaul. The domain subject matter experts are geographically dispersed across three continents. Which consideration is paramount when setting up the logistics (4.1.4.3)?,Ensuring the activity's goals are focused on non-functional requirements.,Selecting communication channels and scheduling times that accommodate multiple time zones.,Limiting the session duration to ensure sufficient detail capture.,Prioritizing highly experienced SMEs over less experienced staff.,B,"Setting up logistics includes identifying communication channels and resources, specifically time zones for dispersed stakeholders.",Elicitation and Collaboration,Medium,0.38,1.3,0.25,0.06,logistics,elicitation-preparation,4.1.4.3,,communication;
"When selecting elicitation techniques (4.1.4.2) for a politically sensitive project, a BA opts for one-on-one Interviews rather than a Workshop. This decision is primarily based on anticipating:",Difficulty in achieving consensus on requirements.,Low stakeholder availability and commitment.,The need to elicit private opinions that stakeholders may be reluctant to express publicly.,The overall cost and time constraints of the project.,C,"Interviews allow interviewees to express opinions in private, suitable for politically sensitive topics.",Elicitation and Collaboration,Medium,0.72,1.45,0.2,0.08,elicitation-techniques,interviews,4.1.4.2,,communication;
A BA is preparing for a session to define the scope of a complex regulatory reporting requirement. Which input helps the BA shape the objectives and focus of the elicitation activity?,Business Analysis Approach.,Stakeholder Engagement Approach.,Needs.,Potential Value.,C,The Needs guides the preparation in terms of the scope and purpose of the elicitation activities.,Elicitation and Collaboration,Easy,-1.55,0.85,0.25,0.02,elicitation-preparation,inputs,4.1.3,,analytical;
The primary output of the Prepare for Elicitation task (4.1) is the:,Elicitation Results (unconfirmed).,Elicitation Activity Plan.,Business Analysis Information (communicated).,Stakeholder Engagement.,B,"The output is the Elicitation Activity Plan, including logistics and scope.",Elicitation and Collaboration,Easy,-2.35,0.8,0.25,0.01,elicitation-activity-plan,outputs,4.1.8,,communication;
