question_text,option_a,option_b,option_c,option_d,correct_answer,explanation,ka,difficulty_label,difficulty_b,discrimination,guess_rate,slip_rate,primary_concept,secondary_concepts,babok_reference,perspectives,competencies
A key measure of effective 'Learning' for a Business Analyst is:,The ability to avoid ambiguity in documentation.,The capacity to apply newly acquired concepts to new areas or relationships.,The ability to influence stakeholders toward a single desired outcome.,The ability to accurately estimate the timeline for complex tasks.,B,Effective learning includes demonstrating the ability to apply concepts to new areas or relationships.,Business Analysis Planning and Monitoring,Easy,0.38,1.3,0.25,0.05,learning,underlying-competencies,9.1.3,,analytical;
A project team is suffering from 'analysis paralysis' due to constantly seeking more data before selecting a solution. The BA steps in and defines clear decision criteria and outlines the uncertainties involved to push the team toward a choice. This action demonstrates proficiency in:,Problem Solving.,Decision Making.,Negotiation.,Facilitation.,B,Decision Making involves understanding criteria and identifying the most desirable option.,Business Analysis Planning and Monitoring,Medium,0.72,1.45,0.2,0.08,decision-making,problem-solving,9.1.2,,analytical;
"The BA receives continuous praise for completing tasks on time, ensuring deliverables meet expectations, and documenting decisions transparently. These actions primarily enhance which behavioral characteristic?",Adaptability.,Personal Accountability.,Trustworthiness.,Ethics.,C,Trustworthiness is enhanced by dependable behavior and achievements of expected results.,Business Analysis Planning and Monitoring,Medium,-1.55,0.85,0.25,0.02,trustworthiness,behavioral-characteristics,9.2.3,,behavioral;
"Which characteristic is described by the BA's ability to adjust their techniques, style, and method of approach when working with highly diverse stakeholders and fluid organizational goals?",Personal Accountability.,Organization and Time Management.,Adaptability.,Business Acumen.,C,Adaptability is the ability to change style and method to increase effectiveness.,Business Analysis Planning and Monitoring,Easy,-2.35,0.8,0.25,0.01,adaptability,behavioral-characteristics,9.2.5,,behavioral;
A BA discovers a conflict of interest involving the recommended vendor. The BA immediately discloses this and ensures the decision-making process remains transparent. This behavior is primarily a demonstration of:,Personal Accountability.,Business Acumen.,Ethics.,Adaptability.,C,Ethical behavior includes full and prompt disclosure of potential conflicts of interest.,Business Analysis Planning and Monitoring,Medium,0.08,1.2,0.25,0.05,ethics,behavioral-characteristics,9.2.1,,behavioral;
A key measure of effective 'Organization and Time Management' is:,The ability to define complex conceptual models quickly.,The successful resolution of conflicts between technical and business stakeholders.,"Complete preparation for meetings, interviews, and workshops.",High proficiency in all collaborative software tools.,C,Effective time management includes complete preparation for meetings and workshops.,Business Analysis Planning and Monitoring,Easy,0.58,1.4,0.25,0.07,organization-time-management,behavioral-characteristics,9.2.4,,behavioral;
"In an organization utilizing a fixed, waterfall methodology, the BA is asked to quickly pivot to an agile approach due to budget cuts requiring incremental delivery. The ability to successfully implement this change demonstrates proficiency in which pair of characteristics?",Trustworthiness and Ethics.,Adaptability and Methodology Knowledge.,Problem Solving and Business Acumen.,Learning and Conceptual Thinking.,B,Switching methodologies requires Adaptability and specific Methodology Knowledge.,Business Analysis Planning and Monitoring,Hard,0.18,1.35,0.15,0.05,adaptability,methodology-knowledge,9.3.5,,behavioral;
A BA is reviewing the financial viability of a strategic initiative by comparing it against industry best practices and major competitor models. This requires strong proficiency in:,Organization Knowledge.,Solution Knowledge.,Industry Knowledge and Business Acumen.,Methodology Knowledge.,C,"Industry Knowledge provides sector trends, while Business Acumen provides principle application.",Business Analysis Planning and Monitoring,Medium,0.44,1.3,0.22,0.06,industry-knowledge,business-acumen,9.3.2,,business-knowledge;
"When a BA is working to improve an existing, complex proprietary solution, proficiency in which competency allows the BA to efficiently identify needed changes and expedite discovery through prior domain experience?",Methodology Knowledge.,Business Acumen.,Solution Knowledge.,Organization Knowledge.,C,Solution Knowledge involves leveraging experience from previous work on the solution.,Business Analysis Planning and Monitoring,Easy,-2.05,0.85,0.25,0.01,solution-knowledge,business-knowledge,9.3.4,,business-knowledge;
"A BA quickly grasps the political landscape, reporting relationships, and informal lines of influence within a new client company. This ability is crucial for effective stakeholder management and demonstrates mastery of:",Industry Knowledge.,Organization Knowledge.,Business Acumen.,Methodology Knowledge.,B,Organization Knowledge includes understanding units and informal communication channels.,Business Analysis Planning and Monitoring,Medium,-1.8,0.9,0.25,0.02,organization-knowledge,business-knowledge,9.3.3,,business-knowledge;
The definition of 'Business Acumen' emphasizes the ability to:,Understand the fundamental business principles and apply knowledge from other situations.,Define all formal organizational reporting structures and hierarchies.,Design technical interfaces for complex IT systems.,Model executable business processes in BPMN.,A,Business acumen is the ability to understand needs using principles from other situations.,Business Analysis Planning and Monitoring,Easy,0.28,1.25,0.25,0.05,business-acumen,business-knowledge,9.3.1,,business-knowledge;
"A BA is facilitating a workshop with globally distributed team members. To minimize ambiguity due to cultural differences and jargon, the BA uses a shared Glossary of terms and concise, standardized visual diagrams. This action demonstrates effective application of:",Non-Verbal Communication.,Written Communication and Visual Thinking.,Verbal Communication and Learning.,Listening and Negotiation.,B,Using standardized aids addresses remote communication and utilizes visual thinking.,Business Analysis Planning and Monitoring,Medium,-0.22,1.15,0.25,0.05,communication-skills,written-communication,9.4.3,,communication;
"During an intense interview, the interviewee's verbal response is positive, but their body language indicates tension and disagreement. The BA recognizes this conflict and asks probing follow-up questions. This scenario highlights the importance of:",Non-Verbal Communication and Listening.,Written Communication and Organization.,Conceptual Thinking and Problem Solving.,Business Acumen and Ethics.,A,Recognizing non-verbal cues requires Non-Verbal and active Listening skills.,Business Analysis Planning and Monitoring,Medium,-1.3,0.95,0.25,0.03,non-verbal-communication,listening,9.4.4,,communication;
"A BA's presentation style emphasizes clear structure, logical sequencing of ideas, and visual aids appropriate for the audience's knowledge level. This is a measure of effective:",Non-Verbal Communication.,Verbal Communication.,Written Communication.,Conceptual Thinking.,B,Effective verbal communication adaptation to the audience is a key measure.,Business Analysis Planning and Monitoring,Easy,0.42,1.3,0.25,0.05,verbal-communication,communication-skills,9.4.1,,communication;
"A BA mediates a difficult negotiation between the budget owner and the solution team regarding scope changes. The BA ensures both parties recognize that their underlying interests may not be in direct opposition, allowing them to find a mutually acceptable solution. This exemplifies proficiency in:",Teamwork.,Leadership and Influencing.,Negotiation and Conflict Resolution.,Teaching.,C,Successful negotiation involves identifying underlying interests to find satisfying solutions.,Business Analysis Planning and Monitoring,Hard,1.88,2.1,0.15,0.12,negotiation-conflict-resolution,interaction-skills,9.5.4,,interaction;
"When performing the 'Teaching' underlying competency, the BA must select the most appropriate teaching approach (visual, auditory, kinesthetic) based on:",The BA's personal learning style.,The complexity of the subject matter and the audience's learning style.,The level of technology available in the meeting room.,The required depth of the final documentation.,B,Teaching requires selecting approaches based on complexity and audience need.,Business Analysis Planning and Monitoring,Easy,-2.55,0.8,0.25,0.01,teaching,interaction-skills,9.5.5,,interaction;
A BA is asked to use a Requirements Management Tool (a Tools and Technology competency) for a high-risk project. The primary benefit provided by this tool is:,Automating the initial brainstorming phase.,"Providing support for requirements workflow, traceability, and change control.",Automatically generating the final Solution Recommendation.,Performing the root cause analysis of system defects.,B,"Requirements management tools support workflow, approvals, and traceability.",Business Analysis Planning and Monitoring,Medium,-0.35,1.2,0.25,0.05,tools-and-technology,requirements-management-tool,9.6.2,,tools-technology;
"A BA is working on a high-velocity agile project focused on internal process improvement. The question, 'Is that need worth satisfying?' is key to which task under the Agile Perspective?",Elicitation and Collaboration.,Solution Evaluation.,Strategy Analysis.,Requirements Analysis and Design Definition.,C,Questions about worthiness of a need drive prioritization in Agile Strategy Analysis.,Agile Perspective,Medium,0.5,1.4,0.2,0.06,agile,strategy-analysis,11.1,agile,analytical;
"In an agile environment, detailed analysis work is typically deferred until the last responsible moment. This approach helps the team primarily to:",Ensure a high level of formality in the documentation.,Maximize flexibility for change and reduce the cost of accommodating late changes.,Eliminate the need for post-implementation testing.,Achieve immediate sign-off from the sponsor.,B,Agile analysis work products are delivered just-in-time to allow flexibility for change.,Agile Perspective,Medium,0.32,1.25,0.22,0.05,agile,adaptive-planning,11.1,agile,analytical;
"In the Agile Perspective, validation of the evolving solution with stakeholders occurs frequently, often replacing the traditional formal requirements approval process. When does this validation typically occur?",Only at the end of the final release.,At the end of every development cycle (iteration).,During initial planning workshops only.,When the Business Architect requests a review.,B,"Validation occurs at the end of every iteration, replacing formal approval.",Agile Perspective,Easy,-1.65,0.9,0.25,0.02,agile,validation,11.1,agile,interaction;
Which agile technique uses fictional characters to help the team understand the needs held by a group or class of users?,Story Mapping.,Kano Analysis.,Personas.,MoSCoW Prioritization.,C,Personas are fictional archetypes used to bring user needs to life.,Agile Perspective,Easy,0.4,1.35,0.25,0.06,personas,agile,11.1,agile,analytical;
A BA on an agile team prioritizes a high-level list of features using the MoSCoW technique. Which factor determines the 'Must Have' category?,Features that provide competitive advantage.,Features required for minimal viability (MVP) or necessary compliance.,Features that can be deferred until the final release.,Features that require the least development effort.,B,'Must Have' category is used for minimal viability or compliance requirements.,Agile Perspective,Medium,-0.18,1.2,0.25,0.04,moscow,prioritization,11.1,agile,analytical;
The primary focus of a Business Intelligence (BI) initiative is the transformation of data into:,Automated process models.,Business rules governing conduct.,Value-added information and analytic insight.,Physical infrastructure requirements.,C,BI focus is transforming data into high-value analytic insight for decision making.,Business Intelligence Perspective,Easy,0.2,1.15,0.25,0.04,bi,analytic-insight,11.2,bi,analytical;
A BI business analyst is defining requirements for a new dashboard intended to predict customer churn risk. This requirement falls under which category of data analytics?,Descriptive analytics.,Diagnostic analytics.,Predictive analytics.,Prescriptive analytics.,C,Predictive analytics identifies trends to make predictions about future events.,Business Intelligence Perspective,Medium,0.54,1.45,0.2,0.07,predictive-analytics,bi,11.2,bi,analytical;
"In the BI Perspective, the BA often needs to ensure information is consistently defined and used across the organization. This effort supports the establishment of a 'single point of truth' and primarily involves producing which artifacts?",Source Logical Data Model and Data Dictionary.,Solution Architecture Diagram.,Process Flowcharts.,User Stories and Acceptance Criteria.,A,BI outcomes include standardized definitions via Data Model and Data Dictionary.,Business Intelligence Perspective,Medium,-2.75,0.75,0.25,0.01,bi,data-dictionary,11.2,bi,analytical;
A demand-driven approach in Business Intelligence assumes which starting point for solution development?,Phasing implementation based on the availability of source data systems.,Mapping existing systems data to define what data is currently available.,"Identifying the information output needed to support business decisions, then tracing back to sources.",Focusing only on unstructured data sources for competitive advantage.,C,Demand-driven starts with identifying output needed for decisions and tracing back.,Business Intelligence Perspective,Medium,0.05,1.2,0.25,0.04,demand-driven,bi,11.2,bi,analytical;
A BI BA is tasked with defining Transformation Rules (8.5). What is the primary purpose of these rules in the BI context?,"To map source and target data elements, specifying requirements for decoding, correction, and enrichment.",To define how the new solution will interact with the customer interface.,To prioritize the backlog items based on complexity.,To set the performance measures for the BI reporting layer.,A,Transformation rules map source and target data elements for correction and enrichment.,Business Intelligence Perspective,Easy,0.38,1.3,0.25,0.05,transformation-rules,bi,11.2,bi,analytical;
"In the Business Architecture (BA-Arch) Perspective, the principle of 'Separation of Concerns' implies that the business architecture must specifically separate what the business does from:",Its underlying IT infrastructure.,How the business is performed.,The organizational structure and who performs the functions.,All of the above.,D,"BA-Arch separates what is done from how, who, when, and how well it is done.",Business Architecture Perspective,Medium,-1.88,0.9,0.25,0.02,separation-of-concerns,ba-arch,11.4,ba-arch,analytical;
A Business Architect is developing a Capability Map (a technique). The purpose of this map is to:,Model the flow of data through the enterprise systems.,"Provide a hierarchical catalogue of what the business does, independent of organizational structure.",Trace individual process steps to their implementing technology.,Define the tactical implementation roadmap for the next two quarters.,B,A Capability Map is a hierarchical catalogue of what the business does.,Business Architecture Perspective,Easy,0.62,1.45,0.25,0.07,capability-map,ba-arch,11.4,ba-arch,analytical;
A key value delivered by Business Architecture models (blueprints) is:,Minimizing the need for project managers on strategic initiatives.,Facilitating coordination across the organization by aligning action with vision and strategy.,Eliminating all non-functional requirements from the project scope.,"Providing detailed, low-level specifications for software coding.",B,Business Architecture facilitates coordination by aligning action with strategy.,Business Architecture Perspective,Medium,-1.45,0.95,0.25,0.03,ba-arch,alignment,11.4,ba-arch,analytical;
"When performing Strategy Analysis (6.1/6.2) in a BA-Arch context, the focus of analyzing the current state should be on:",Individual system defects and performance degradation.,"High-level enterprise components such as value streams, capabilities, and organizational structure.",The detailed functional requirements of the legacy system.,The performance of a single business process.,B,"BA-Arch operates at the enterprise level, focusing on capabilities and value streams.",Business Architecture Perspective,Medium,0.24,1.35,0.22,0.05,ba-arch,enterprise-scope,11.4,ba-arch,analytical;
"The Business Architect, working in the Requirements Analysis and Design Definition KA, synthesizes knowledge from multiple architectural views (e.g., capability, value, information) to determine if proposed changes:",Are technically feasible within the current IT architecture.,Work towards or conflict with the organization's goals.,Can be completed within the current fiscal budget.,Have already been formally approved by the Project Manager.,B,Architects synthesize views to determine if changes align or conflict with strategy.,Business Architecture Perspective,Medium,0.46,1.4,0.22,0.06,ba-arch,strategic-alignment,11.4,ba-arch,analytical;
The primary focus of Business Process Management (BPM) initiatives is:,How the organization performs work to deliver value across multiple functional areas to customers and stakeholders.,The selection and implementation of commercial off-the-shelf software.,The compliance with external regulatory standards only.,Automating all manual tasks within a single department.,A,BPM focuses on delivering value across functional areas via a process lens.,Business Process Management Perspective,Easy,2.62,2.15,0.25,0.15,bpm,purpose,11.5,bpm,analytical;
A BA leading a BPM initiative uses the execution and monitoring phase of the BPM life cycle. What unique value does this phase provide for requirements analysis and design improvement?,Objective data collected from the actual execution of processes is used to justify process redesign.,Simulation of theoretical models minimizes the risk of implementation failure.,Requirements are formally documented in BPMN notation for developer hand-off.,It establishes the foundational business case for the entire initiative.,A,Execution provides objective data used to modify models and designs for optimization.,Business Process Management Perspective,Medium,-0.12,1.2,0.25,0.05,bpm,execution-monitoring,11.5,bpm,analytical;
Which stakeholder is considered the key decision maker and holds responsibility/authority for approving any changes to the affected processes in a BPM initiative?,The Project Manager.,The Regulator.,The Process Owner.,The End User.,C,The Process Owner is responsible for the process and final decisions regarding changes.,Business Process Management Perspective,Easy,-0.45,1.15,0.25,0.04,process-owner,stakeholders,11.5,bpm,interaction;
A BA conducting process analysis uses Value Stream Mapping (VSM). This technique is primarily used to identify:,Data flows and data stores within the process boundary.,Value-adding and non-value-adding (waste) elements across the end-to-end process.,The optimal technology platform for process automation.,All functional requirements for the required IT system.,B,VSM depicts both value-adding and non-value-adding elements in a product stream.,Business Process Management Perspective,Medium,0.78,1.45,0.22,0.07,vsm,waste-identification,10.34,bpm,analytical;
A BA identifies a set of business rules that dictate customer eligibility for a discount. These rules should be mapped to the process through which mechanism?,They should be embedded as steps within the process flowchart.,They should be modelled independently and mapped to the business decision they influence within the process.,They should be documented as Non-Functional Requirements.,They should be governed by the Project Manager's change control process.,B,Decisions should be modelled independently and mapped to the processes they influence.,Business Process Management Perspective,Medium,-2.15,0.85,0.25,0.01,business-rules,decision-modelling,10.9,bpm,analytical;
The BA must establish explicit agreement on the minimal set of conditions a new solution must meet to be worth implementation. This describes the use of which technique?,Metrics and Key Performance Indicators (KPIs).,Acceptance Criteria.,Requirements Traceability.,Estimation.,B,Acceptance criteria define requirements or conditions that must be met for acceptance.,Requirements Analysis and Design Definition,Easy,0.35,1.25,0.25,0.05,acceptance-criteria,definition,10.1,,interaction;
A BA is drafting Acceptance Criteria for a user story (7.1). The criteria must be expressed in a testable form and presented as statements that can be verified as true or false. This preparation often involves:,Ensuring the requirement is at the highest level of abstraction.,Decomposing the requirement into atomic statements.,Obtaining financial forecasts from the sponsor.,Ignoring non-functional concerns.,B,Testability often requires breaking requirements down into an atomicPass/Fail form.,Requirements Analysis and Design Definition,Medium,0.56,1.45,0.22,0.07,acceptance-criteria,atomic,10.1,,analytical;
The primary advantage of using the Acceptance and Evaluation Criteria technique is:,It prevents all future changes to requirements.,It allows for the objective and consistent assessment of solutions and alternative designs.,It replaces the need for continuous stakeholder collaboration.,It transfers risk entirely to the implementation team.,B,Measurable criteria allow for the objective assessment of solutions.,Requirements Analysis and Design Definition,Easy,-0.08,1.2,0.25,0.04,acceptance-criteria,benefit,10.1,,analytical;
A BA uses a Balance Scorecard (a technique) during Define Future State (6.2). The primary benefit of this tool is:,Its focus solely on optimizing the IT infrastructure.,Its focus on optimizing only the financial and customer dimensions.,"Its outcome focus, providing a balanced view of the enterprise by integrating objectives and measures across four dimensions.",Its ability to eliminate all organizational risk.,C,"Balanced scorecards integrate objectives across Learning, Process, Customer, and Financial.",Strategy Analysis,Medium,0.44,1.35,0.22,0.06,balanced-scorecard,purpose,10.3,,analytical;
"When performing Backlog Management (a technique), items near the top of the backlog typically require more attention than items near the bottom because:",Items near the top usually have the highest business value and priority and are elaborated in more detail.,Items near the bottom are always deleted from the project scope.,Items near the top require less effort to estimate.,Items near the top are typically non-functional requirements.,A,Top items have highest value/priority and are elaborated in more detail.,Requirements Life Cycle Management,Medium,-1.72,0.9,0.25,0.02,backlog-management,prioritization,10.2,,analytical;
"A growing backlog over several iterations, despite steady team velocity, is an indicator that requires investigation using root cause analysis. This situation typically suggests:",An increase in demand or a drop in productivity.,An increase in requirements quality due to thorough elicitation.,A necessary shift to a predictive methodology.,A definitive estimation of all remaining work items.,A,Growing backlogs indicate either increased demand or a drop in productivity.,Requirements Life Cycle Management,Medium,2.05,1.9,0.25,0.12,backlog-management,metrics,10.2,,analytical;
The primary input used to justify the pursuit of a new initiative based on predicted benefits versus costs is contained within the:,Business Analysis Approach.,Business Case.,Requirements Architecture.,Solution Recommendation.,B,The Business Case justifies action based on benefits versus cost.,Strategy Analysis,Easy,-2.25,0.85,0.25,0.01,business-case,justification,10.7,,analytical;
"When structuring a Business Case (a technique), the 'Desired Outcomes' element should primarily focus on:",The exact process flow of the recommended solution.,Measurable outcomes independent of the recommended solution.,The resumes and experience of the implementation team.,The technical specifications of the current state.,B,Desired outcomes should include measurable results independent of the solution.,Strategy Analysis,Medium,0.48,1.4,0.2,0.06,business-case,desired-outcomes,10.7,,analytical;
"A BA utilizes Interviews (a technique) to gather information from a stakeholder. To maximize the clarity and completeness of the elicited information, the BA should primarily:",Use only open-ended questions to allow the stakeholder free rein.,Send the interview questions to the stakeholder immediately after the interview.,"Organize the questions based on priority and subject, and use active listening to confirm understanding.",Avoid taking notes to maintain full attention on the interviewee.,C,Interviews require structured questions and active listening to confirm understanding.,Elicitation and Collaboration,Medium,-0.25,1.15,0.25,0.04,interviews,active-listening,10.25,,communication;
