question_text,option_a,option_b,option_c,option_d,correct_answer,explanation,ka,difficulty_label,difficulty_b,discrimination,guess_rate,slip_rate,primary_concept,secondary_concepts,babok_reference,perspectives,competencies
A key element of preparing stakeholders (4.1.4.5) involves explaining the elicitation technique to ensure buy-in. What risk is mitigated by ensuring stakeholders understand the purpose and process of the session?,The risk of scope creep during the elicitation activity.,The risk that stakeholders may be unresponsive or challenging if they misunderstand the activity's purpose.,The risk that the elicitation results cannot be traced to the original needs.,The risk that key documents (supporting material) are unavailable.,B,Ensuring stakeholders understand the process mitigates the risk that they will be unresponsive or challenging.,Elicitation and Collaboration,Medium,0.08,1.2,0.25,0.05,stakeholder-management,buy-in,4.1.4.5,,interaction;
A BA must select techniques for a session intended to collaboratively identify and reach consensus on possible causes of a known process delay. Which technique combination is most effective?,Interviews and Document Analysis.,Brainstorming and Mind Mapping.,Observation and Survey/Questionnaire.,Financial Analysis and Estimation.,B,Brainstorming and Mind Mapping are recommended to collaboratively identify and reach consensus.,Elicitation and Collaboration,Medium,0.58,1.4,0.2,0.06,consensus,elicitation-techniques,4.1.6,,analytical;
"A Business Analyst needs to discover information that cannot be reliably drawn from people or existing documents, such as confirming user behavior with a new interface element. Which type of elicitation should the BA plan to conduct?",Collaborative.,Research.,Experiments.,Observation.,C,"Experiments involve identifying information through controlled tests, used to discover unknown information.",Elicitation and Collaboration,Medium,0.18,1.35,0.25,0.05,experiments,elicitation-types,4.2.2,,analytical;
"During the Conduct Elicitation task (4.2), a BA finds that stakeholders are repeatedly discussing topics outside the documented scope of the activity. What immediate action should the BA take, guided by the 'Guide Elicitation Activity' element?",Terminate the session immediately and reschedule.,Document the out-of-scope discussion thoroughly as new requirements.,"Recognize the deviation and guide the conversation back to the activity goal, or acknowledge and continue, based on their judgment.",Refer the topic to the Project Manager for formal change control assessment.,C,The BA needs to recognize deviations and determine whether to guide the conversation back or continue based on judgment.,Elicitation and Collaboration,Medium,0.44,1.45,0.2,0.07,interaction-skills,elicitation-execution,4.2.4.1,,interaction;
Which technique involves defining key terms and ideas and establishing the relationships between them to organize domain knowledge elicited during an activity?,Concept Modelling.,Data Modelling.,Data Mining.,Business Rules Analysis.,A,Concept Modelling identifies key terms and defines relationships to structure domain knowledge.,Elicitation and Collaboration,Easy,-2.05,0.85,0.25,0.01,concept-modelling,domain-knowledge,10.11,,analytical;
The primary output of the Conduct Elicitation task (4.2) is the:,Elicitation Results (unconfirmed).,Confirmed Elicitation Results.,Requirements (specified and modelled).,Requirements Architecture.,A,"The output is Elicitation Results (unconfirmed), captured format-specific information.",Elicitation and Collaboration,Easy,-1.8,0.9,0.25,0.02,elicitation-results,outputs,4.2.8,,communication;
"While conducting elicitation, a BA utilizes prototyping. What is the main benefit of using a prototype in this context?","To create final, deployable code quickly.",To elicit and validate stakeholders' needs through an iterative model.,To formally document all functional requirements.,To reduce the necessity for subsequent technical design.,B,Prototyping elicits and validates needs through an iterative model.,Elicitation and Collaboration,Medium,0.28,1.25,0.25,0.05,prototyping,validation,10.36,,communication;
A BA is leading a highly productive collaborative game (4.2) intended to generate ideas for a new product feature set. Which behavioral characteristic is most necessary for the BA to demonstrate during the session to maximize creative output and participation?,Personal Accountability.,Creative Thinking.,Technical Expertise.,Trustworthiness.,B,Collaborative games stimulate creative solutions and rely on Creative Thinking.,Elicitation and Collaboration,Medium,-0.22,1.15,0.25,0.05,creative-thinking,collaborative-games,9.1.1,,analytical;
The purpose of Confirm Elicitation Results (4.3) is to:,Obtain formal approval of the requirements from the sponsor.,Check the gathered information for accuracy and consistency with other information.,Specify and model requirements into formal documentation.,Prioritize all elicited requirements based on business value.,B,The purpose is to check gathered information for accuracy and consistency.,Elicitation and Collaboration,Easy,-1.3,0.95,0.25,0.03,elicitation-confirmation,purpose,4.3.1,,communication;
A BA compares an elicitation result (a process model draft) against a foundational source document (a process guide) and identifies a conflict in activity sequencing. This activity is part of which element of Confirm Elicitation Results (4.3)?,Compare Elicitation Results Against Source Information.,Compare Elicitation Results Against Other Elicitation Results.,Perform Root Cause Analysis.,Verify Requirements.,A,Comparing results against source information ensures captured information reflects inputs received.,Elicitation and Collaboration,Medium,0.42,1.35,0.22,0.06,comparison,elicitation-confirmation,4.3.4.1,,analytical;
Why is confirming elicitation results (4.3) considered a less rigorous and formal review than the verification activities performed in the Requirements Analysis and Design Definition knowledge area?,"Confirmation typically involves technical subject matter experts, while verification involves business stakeholders.","Confirmation focuses on initial accuracy and consistency of inputs, whereas verification checks adherence to quality standards and usability.","Confirmation requires written sign-off, whereas verification relies on verbal agreement.","Confirmation addresses scope, while verification addresses feasibility.",B,Confirmation ensures captured info is correct before analysis; Verification ensures specifications meet quality standards.,Elicitation and Collaboration,Hard,1.88,2.1,0.15,0.12,quality-checks,elicitation-confirmation,4.3.2,,analytical;
The primary output of the Confirm Elicitation Results task (4.3) is the:,Elicitation Results (confirmed).,Requirements (specified and modelled).,Design Options.,Current State Description.,A,"The output is Elicitation Results (confirmed), reflecting agreement that information is useful.",Elicitation and Collaboration,Easy,-2.55,0.8,0.25,0.01,elicitation-results,outputs,4.3.8,,communication;
Which technique is explicitly used in Confirm Elicitation Results (4.3) to formally or informally check a set of results with a group of stakeholders?,Interviews.,Reviews.,Workshops.,Both B and C.,D,Reviews and Workshops are used to confirm results with stakeholders.,Elicitation and Collaboration,Medium,-0.35,1.2,0.25,0.05,reviews,workshops,10.37,,interaction;
The most crucial stakeholder group responsible for providing expertise to confirm that elicited information is correct and identifies omissions or inconsistencies is the:,Sponsor.,Project Manager.,Domain Subject Matter Expert.,Tester.,C,Domain Subject Matter Experts possess knowledge to confirm correctness and identify omissions.,Elicitation and Collaboration,Medium,0.5,1.4,0.2,0.06,d-sme,stakeholders,4.3.7,,interaction;
A BA is preparing a finalized communication package (4.4) for the Implementation Subject Matter Experts (SMEs). Which format should the BA prioritize to ensure the SMEs understand the required technical implementation details?,Informal documentation showing high-level process flows.,Presentations summarizing business goals and objectives.,"Formal documentation including detailed text, matrices, and UML diagrams.",Group collaboration sessions focused on conflict resolution.,C,"For Implementation SMEs, Formal Documentation with technical detail is often preferred.",Elicitation and Collaboration,Medium,0.32,1.3,0.25,0.05,formal-documentation,i-sme,4.4.4.1,it,communication;
The primary purpose of Communicate Business Analysis Information (4.4) is to:,Obtain approvals for prioritized requirements.,Ensure stakeholders have a shared understanding of business analysis information.,Determine how the information will be stored and reused long-term.,Conduct post-implementation review of the solution.,B,The purpose is to ensure stakeholders have a shared understanding of BA information.,Elicitation and Collaboration,Easy,-1.65,0.9,0.25,0.02,communication,purpose,4.4.1,,communication;
A BA chooses an e-mail communication platform (4.4.4.2) for distributing a finalized data model update. This choice is best suited when:,The information is highly complex and requires immediate discussion.,Stakeholders need extensive verbal explanation to understand the information.,There is a high maturity level of information that will need little or no verbal explanation.,The communication's purpose is to resolve outstanding conflicts.,C,Non-verbal methods are best when there is high maturity level and little explanation needed.,Elicitation and Collaboration,Medium,0.4,1.25,0.25,0.05,communication-platform,communication,4.4.4.2,,communication;
Which guideline/tool directly assists the BA in determining how the requirements package (content and format) will be communicated to various stakeholders in task 4.4?,Information Management Approach.,Business Analysis Approach.,Business Analysis Information.,Requirements Architecture.,A,Information Management Approach helps determine packaging and communication format.,Elicitation and Collaboration,Medium,-0.18,1.2,0.25,0.04,information-management,guidelines,4.4.5,,analytical;
The BA decides to host a workshop (a technique) to communicate the finalized requirements package (4.4). Which output should the BA aim to achieve using this format?,"Elicit new, previously undiscovered requirements.",Obtain consensus and possibly approvals on the package.,Document all future traceability links.,Identify stakeholders for the next project phase.,B,Workshops are useful for providing feedback and gaining consensus/approvals.,Elicitation and Collaboration,Medium,0.2,1.35,0.22,0.05,workshops,consensus,10.5,,interaction;
"During Manage Stakeholder Collaboration (4.5), monitoring stakeholder engagement (4.5.4.2) is necessary to continually assess risks. Which risk is the BA monitoring for specifically related to the timely completion of BA work?",Stakeholders becoming diverted to other non-project work.,Technical resources failing to deliver the solution components.,The sponsor withdrawing budget approval.,The project manager changing the delivery timeline.,A,BAs monitor risks such as stakeholders being diverted to other work.,Elicitation and Collaboration,Medium,0.54,1.4,0.2,0.07,risk-monitoring,collaboration-management,4.5.4.2,,behavioral;
The purpose of Manage Stakeholder Collaboration (4.5) is to:,Ensure all requirements are traced to business objectives.,Encourage stakeholders to work towards a common goal.,Define metrics for solution performance assessment.,Formalize the process for gaining requirement approval.,B,The purpose is to encourage stakeholders to work towards a common goal.,Elicitation and Collaboration,Easy,-2.75,0.75,0.25,0.01,collaboration-management,purpose,4.5.1,,interaction;
Which guideline/tool helps focus diverse stakeholders on a common vision of desired business outcomes during collaboration activities?,Future State Description.,Stakeholder Engagement Approach.,Risk Analysis Results.,Business Analysis Performance Assessment.,A,The Future State Description can be used to focus stakeholders on a common goal.,Elicitation and Collaboration,Medium,0.05,1.2,0.25,0.04,future-state,guidelines,4.5.5,,analytical;
"When a conflict arises during collaboration, the BA must rely heavily on which Interaction Skill to resolve differences and maintain working relationships?",Creative Thinking.,Conceptual Thinking.,Negotiation and Conflict Resolution.,Systems Thinking.,C,Negotiation and Conflict Resolution is crucial for maintaining working relationships.,Elicitation and Collaboration,Medium,0.38,1.45,0.2,0.06,interaction-skills,conflict-resolution,9.5.4,,interaction;
The most critical output of Manage Stakeholder Collaboration (4.5) is:,Confirmed Elicitation Results.,Stakeholder Engagement.,Change Strategy.,Elicitation Activity Plan.,B,"The output is Stakeholder Engagement, representing willingness to interact.",Elicitation and Collaboration,Easy,-1.88,0.9,0.25,0.02,stakeholder-engagement,outputs,4.5.8,,interaction;
A BA is tracing requirements (5.1) for a critical component of a complex system. The BA identifies a link between a functional requirement and the specific module of the system implementing it. This relationship type is classified as:,Derive.,Depends.,Validate.,Satisfy.,D,The Satisfy relationship links implementation to the requirements it satisfies.,Requirements Life Cycle Management,Medium,0.62,1.45,0.2,0.07,satisfy,relationships,5.1.4.2,it,analytical;
The purpose of Trace Requirements (5.1) is to:,Ensure that requirements are defined correctly and meet quality standards.,"Analyze and maintain the relationships between requirements, designs, and other work products.",Rank requirements to determine their relative importance to stakeholders.,Obtain consensus and formal approval on the requirements package.,B,The purpose is to analyze and maintain relationships between requirements and designs.,Requirements Life Cycle Management,Easy,-1.45,0.95,0.25,0.03,traceability,purpose,5.1.1,,analytical;
Which external factor most significantly increases the required formality and effort needed when tracing requirements (5.1)?,The geographical distribution of stakeholders.,An increase in the total number of requirements.,The methodology being adaptive rather than predictive.,The project being managed by a new Project Manager.,B,Traceability effort grows significantly as the number of requirements increases.,Requirements Life Cycle Management,Medium,0.24,1.35,0.22,0.05,formality,complexity,5.1.4.1,,analytical;
"During Trace Requirements (5.1), a BA links a high-level business requirement to a lower-level stakeholder requirement that originated from it. This relationship type is classified as:",Validate.,Depends (Necessity).,Derive.,Satisfy.,C,The Derive relationship links requirements on different levels of abstraction.,Requirements Life Cycle Management,Medium,0.46,1.4,0.2,0.06,derive,relationships,5.1.4.2,,analytical;
The Governance Approach serves as a critical input to Trace Requirements (5.1) because it helps the BA determine:,The expected benefit of maintaining traceability.,The tools used for the traceability repository.,The level of detail required for traceability links.,The stakeholders who must approve the traceability links.,A,The Information Management Approach (guided by Governance) provides traceability decisions to add value without overhead.,Requirements Life Cycle Management,Hard,2.62,2.15,0.15,0.15,ba-governance,inputs,5.1.5,,analytical;
The output of Trace Requirements (5.1) is Requirements (traced) and Designs (traced). What is the primary use of this output for other tasks?,To detect missing functionality or implemented functionality that is not supported by any requirement.,To accelerate the writing of user stories and acceptance criteria.,To formally hand off requirements to the technical architecture team.,To justify the budget of the solution implementation.,A,Traceability detects missing functionality or unsupported implementation.,Requirements Life Cycle Management,Medium,-0.12,1.2,0.25,0.05,traceability,outputs,5.1.2,,analytical;
The core concept 'Solution' is primarily addressed during Trace Requirements (5.1) by ensuring that:,The solution architecture is independent of the business need.,Requirements are linked to the specific solution components that satisfy them.,The proposed change strategy is aligned with the organizational goals.,All transition requirements are documented before solution deployment.,B,Trace Requirements traces requirements to components to ensure the solution satisfies the need.,Requirements Life Cycle Management,Medium,-0.45,1.15,0.25,0.04,core-concepts,solution,5.1.2,,analytical;
The purpose of Maintain Requirements (5.2) is to:,Assess the performance of the solution after implementation.,Retain requirement accuracy and consistency throughout the life cycle and support reuse.,Obtain explicit approval for all business requirements.,Define the target metrics for measuring future state success.,B,The purpose is to retain accuracy throughout the life cycle and support reuse.,Requirements Life Cycle Management,Easy,0.78,0.95,0.25,0.06,requirements-maintenance,purpose,5.2.1,,analytical;
A business analyst is reviewing aged requirements for a core business process to determine if they are candidates for reuse (5.2.4.3). Which type of requirement is most likely to be reusable and require maintenance for the long term?,Regulatory requirements that govern ongoing organizational adherence.,Specific functional requirements tied to a soon-to-be-retired application.,Temporary transition requirements regarding data migration.,User stories describing an interface mock-up.,A,Ongoing obligations like regulatory requirements are potential candidates for long-term reuse.,Requirements Life Cycle Management,Medium,-2.15,0.85,0.25,0.01,requirements-reuse,regulatory,5.2.4.3,,analytical;
"During Maintain Requirements (5.2), a BA notes that a requirement attribute, 'Stability,' has shifted from 'Low' to 'High.' Which accompanying action must the BA perform, even though the requirement content itself hasn't changed?",Update the requirement's definition to reflect the new stability.,Update the relationships between the requirement and its associated business analysis information.,Request immediate re-prioritization of the requirement.,Remove the requirement from the traceability repository.,B,Business analysts maintain relationships among requirements to ensure context is preserved.,Requirements Life Cycle Management,Medium,0.35,1.25,0.22,0.05,relationships,attributes,5.2.4.1,,analytical;
A BA uses Process Modelling as a technique during Maintain Requirements (5.2). How does this technique primarily support the task?,To graphically define the business rules associated with the process.,To define the flow of control and timing constraints.,To identify requirements associated with the processes that may be available for reuse.,To help identify new requirements needed to fix defects.,C,Process Modelling identifies requirements associated with processes for reuse.,Requirements Life Cycle Management,Medium,0.56,1.4,0.2,0.07,process-modelling,requirements-reuse,5.2.6,,analytical;
The principle that requirements intended for reuse should be written with limited reference to specific solutions or organizational structure supports the effectiveness of which requirement characteristic?,High Priority.,High Abstraction.,Low Technicality.,Low Urgency.,B,Requirements at high levels of abstraction tend to be more reusable.,Requirements Life Cycle Management,Medium,-0.08,1.2,0.25,0.04,abstraction,requirements-reuse,5.2.4.3,,analytical;
The purpose of Prioritize Requirements (5.3) is to:,Establish traceability links between requirements and solution components.,Rank requirements in the order of relative importance.,Verify requirements against quality standards.,Determine solution options and their feasibility.,B,The purpose is to rank requirements in order of importance.,Requirements Life Cycle Management,Easy,0.44,0.95,0.25,0.04,prioritization,purpose,5.3.1,,analytical;
"A BA is facilitating a prioritization session (5.3) for a new software release. The Implementation Subject Matter Experts strongly argue for prioritizing Requirement X (high cost, complex dependencies) over Requirement Y (low cost, high business value). Their reasoning is likely based on maximizing value by considering which factor?","Risk, specifically reducing the probability of technical non-feasibility early on.","Penalty, avoiding regulatory non-compliance.","Time Sensitivity, addressing a contractual deadline.","Dependencies, minimizing the total number of linked requirements.",A,"If technical feasibility is a risk, the most difficult requirement may be prioritized first.",Requirements Life Cycle Management,Hard,-1.72,1.8,0.25,0.08,prioritization,risk,5.3.4.1,,analytical;
The prioritization factor 'Penalty' (5.3.4.1) primarily influences priority based on:,The estimated financial cost to implement the requirement.,The negative consequences resulting from NOT implementing the requirement.,The organizational capacity to absorb the change associated with the requirement.,The likelihood that the requirement definition will change.,B,"Penalty refers to consequences from not implementing a requirement, such as regulatory demands.",Requirements Life Cycle Management,Easy,2.05,0.9,0.25,0.1,penalty,prioritization,5.3.4.1,,analytical;
Which input is necessary for the Prioritize Requirements task (5.3) to ensure the team adheres to the agreed-upon method for ranking requirements?,Requirements Architecture.,Change Strategy.,Governance Approach.,Solution Scope.,C,The Governance Approach outlines the method and criteria for prioritization.,Requirements Life Cycle Management,Medium,-2.25,0.85,0.25,0.01,governance-approach,inputs,5.3.5,,analytical;
The BA is leading a negotiation session (5.3.4.4) where stakeholders have conflicting priorities regarding a new product feature set. The BA successfully resolves the conflict by getting the stakeholders to agree on implementing a subset of features immediately and deferring the remainder. This success directly contributes to maximizing which core concept?,Need.,Context.,Value.,Change.,C,Prioritization ensures maximum value is achieved when resources are constrained.,Requirements Life Cycle Management,Medium,0.48,1.4,0.2,0.06,core-concepts,value,2.1,,interaction;
The purpose of Assess Requirements Changes (5.4) is to:,Evaluate the implications of proposed changes to requirements and designs.,Formally accept the requirements package before baselining.,Determine the feasibility of implementing the proposed solution.,Ensure all requirements trace back to the business case.,A,The purpose is to evaluate implications of proposed changes to requirements and designs.,Requirements Life Cycle Management,Easy,-0.25,1.15,0.25,0.04,change-assessment,purpose,5.4.1,,analytical;
"A stakeholder proposes a major change to an approved design. As the BA performs the impact analysis (5.4.4.2), which dimension should be assessed in conjunction with Cost, Benefit, and Schedule?","Urgency, focusing on necessity driven by regulatory or safety issues.","Author, validating the source of the requirement.","Stability, measuring the likelihood of further refinement.","Ownership, determining who controls the resource budget.",A,"Impact analysis considers Benefit, Cost, impact, Schedule, and Urgency.",Requirements Life Cycle Management,Medium,-1.38,0.95,0.25,0.03,impact-analysis,urgency,5.4.4.2,,analytical;
A BA is determining the formality required for assessing a proposed change (5.4.4.1). The project uses an adaptive approach with short iterations. Which statement regarding formality is true in this context?,Adaptive approaches always require high formality to manage frequent changes.,"Adaptive approaches may require less formality, leveraging iterative techniques to minimize disruption.","Formality is determined solely by the regulatory constraints, regardless of methodology.",The assessment must be entirely deferred until the end of the implementation phase.,B,"An adaptive approach may require less formality, as iterative implementation minimizes the impact.",Requirements Life Cycle Management,Medium,0.32,1.25,0.22,0.05,formality,adaptive-approach,5.4.4.1,agile,analytical;
"Which output provides the necessary recommendation to approve, modify, or deny a proposed change to requirements?",Requirements Change Assessment.,Designs Change Assessment.,Governance Approach.,Requirements (approved).,A,The Requirements Change Assessment output contains the recommendation regarding a change.,Requirements Life Cycle Management,Easy,0.1,1.2,0.25,0.05,change-assessment,outputs,5.4.8,,analytical;
Traceability is listed as a guideline/tool for Assess Requirements Changes (5.4). How is traceability primarily used in this task?,It ensures the cost of the proposed change is accurately estimated.,It identifies all related requirements or solution components that may also require modification due to the proposed change.,It formalizes the change request documentation.,It facilitates communication of the change assessment results to the Sponsor.,B,Traceability identifies all related requirements or components that may also require change.,Requirements Life Cycle Management,Medium,-2.45,0.85,0.25,0.01,traceability,impact-analysis,5.4.5,,analytical;
